[
  {
    "id": 1,
    "name": "الفاتحة",
    "transliteration": "Al-Fatihah",
    "translation": "Öppningen",
    "type": "meccan",
    "total_verses": 7
  },
  {
    "id": 2,
    "name": "البقرة",
    "transliteration": "Al-Baqarah",
    "translation": "Kon",
    "type": "medinan",
    "total_verses": 286
  },
  {
    "id": 3,
    "name": "آل عمران",
    "transliteration": "Ali 'Imran",
    "translation": "Imrans Ätt",
    "type": "medinan",
    "total_verses": 200
  },
  {
    "id": 4,
    "name": "النساء",
    "transliteration": "An-Nisa",
    "translation": "Kvinnor",
    "type": "medinan",
    "total_verses": 176
  },
  {
    "id": 5,
    "name": "المائدة",
    "transliteration": "Al-Ma'idah",
    "translation": "Den Himmelska Måltiden",
    "type": "medinan",
    "total_verses": 120
  },
  {
    "id": 6,
    "name": "الأنعام",
    "transliteration": "Al-An'am",
    "translation": "Boskap",
    "type": "meccan",
    "total_verses": 165
  },
  {
    "id": 7,
    "name": "الأعراف",
    "transliteration": "Al-A'raf",
    "translation": "Urskiljning",
    "type": "meccan",
    "total_verses": 206
  },
  {
    "id": 8,
    "name": "الأنفال",
    "transliteration": "Al-Anfal",
    "translation": "Krigsbyte",
    "type": "medinan",
    "total_verses": 75
  },
  {
    "id": 9,
    "name": "التوبة",
    "transliteration": "At-Tawbah",
    "translation": "Ånger",
    "type": "medinan",
    "total_verses": 129
  },
  {
    "id": 10,
    "name": "يونس",
    "transliteration": "Yunus",
    "translation": "Jonah",
    "type": "meccan",
    "total_verses": 109
  },
  {
    "id": 11,
    "name": "هود",
    "transliteration": "Hud",
    "translation": "Hud",
    "type": "meccan",
    "total_verses": 123
  },
  {
    "id": 12,
    "name": "يوسف",
    "transliteration": "Yusuf",
    "translation": "Josef",
    "type": "meccan",
    "total_verses": 111
  },
  {
    "id": 13,
    "name": "الرعد",
    "transliteration": "Ar-Ra'd",
    "translation": "Åskan",
    "type": "medinan",
    "total_verses": 43
  },
  {
    "id": 14,
    "name": "ابراهيم",
    "transliteration": "Ibrahim",
    "translation": "Abraham",
    "type": "meccan",
    "total_verses": 52
  },
  {
    "id": 15,
    "name": "الحجر",
    "transliteration": "Al-Hijr",
    "translation": "Al-Hijr",
    "type": "meccan",
    "total_verses": 99
  },
  {
    "id": 16,
    "name": "النحل",
    "transliteration": "An-Nahl",
    "translation": "Biet",
    "type": "meccan",
    "total_verses": 128
  },
  {
    "id": 17,
    "name": "الإسراء",
    "transliteration": "Al-Isra",
    "translation": "Den Nattliga Resan",
    "type": "meccan",
    "total_verses": 111
  },
  {
    "id": 18,
    "name": "الكهف",
    "transliteration": "Al-Kahf",
    "translation": "Grottan",
    "type": "meccan",
    "total_verses": 110
  },
  {
    "id": 19,
    "name": "مريم",
    "transliteration": "Maryam",
    "translation": "Maria",
    "type": "meccan",
    "total_verses": 98
  },
  {
    "id": 20,
    "name": "طه",
    "transliteration": "Taha",
    "translation": "Ta-Ha",
    "type": "meccan",
    "total_verses": 135
  },
  {
    "id": 21,
    "name": "الأنبياء",
    "transliteration": "Al-Anbya",
    "translation": "Profeterna",
    "type": "meccan",
    "total_verses": 112
  },
  {
    "id": 22,
    "name": "الحج",
    "transliteration": "Al-Hajj",
    "translation": "Vallfärden",
    "type": "medinan",
    "total_verses": 78
  },
  {
    "id": 23,
    "name": "المؤمنون",
    "transliteration": "Al-Mu'minun",
    "translation": "De Troende",
    "type": "meccan",
    "total_verses": 118
  },
  {
    "id": 24,
    "name": "النور",
    "transliteration": "An-Nur",
    "translation": "Ljus",
    "type": "medinan",
    "total_verses": 64
  },
  {
    "id": 25,
    "name": "الفرقان",
    "transliteration": "Al-Furqan",
    "translation": "Måttstocken",
    "type": "meccan",
    "total_verses": 77
  },
  {
    "id": 26,
    "name": "الشعراء",
    "transliteration": "Ash-Shu'ara",
    "translation": "Poeterna",
    "type": "meccan",
    "total_verses": 227
  },
  {
    "id": 27,
    "name": "النمل",
    "transliteration": "An-Naml",
    "translation": "Myrorna",
    "type": "meccan",
    "total_verses": 93
  },
  {
    "id": 28,
    "name": "القصص",
    "transliteration": "Al-Qasas",
    "translation": "Berättelsen",
    "type": "meccan",
    "total_verses": 88
  },
  {
    "id": 29,
    "name": "العنكبوت",
    "transliteration": "Al-'Ankabut",
    "translation": "Spindeln",
    "type": "meccan",
    "total_verses": 69
  },
  {
    "id": 30,
    "name": "الروم",
    "transliteration": "Ar-Rum",
    "translation": "Bysantinerna",
    "type": "meccan",
    "total_verses": 60
  },
  {
    "id": 31,
    "name": "لقمان",
    "transliteration": "Luqman",
    "translation": "Luqman",
    "type": "meccan",
    "total_verses": 34
  },
  {
    "id": 32,
    "name": "السجدة",
    "transliteration": "As-Sajdah",
    "translation": "De Faller Ned I Tillbedjan",
    "type": "meccan",
    "total_verses": 30
  },
  {
    "id": 33,
    "name": "الأحزاب",
    "transliteration": "Al-Ahzab",
    "translation": "De Sammansvurna",
    "type": "medinan",
    "total_verses": 73
  },
  {
    "id": 34,
    "name": "سبإ",
    "transliteration": "Saba",
    "translation": "Saba",
    "type": "meccan",
    "total_verses": 54
  },
  {
    "id": 35,
    "name": "فاطر",
    "transliteration": "Fatir",
    "translation": "Himlarnas Och Jordens Skapare",
    "type": "meccan",
    "total_verses": 45
  },
  {
    "id": 36,
    "name": "يس",
    "transliteration": "Ya-Sin",
    "translation": "Ya-Sin",
    "type": "meccan",
    "total_verses": 83
  },
  {
    "id": 37,
    "name": "الصافات",
    "transliteration": "As-Saffat",
    "translation": "I Sluten Ordning",
    "type": "meccan",
    "total_verses": 182
  },
  {
    "id": 38,
    "name": "ص",
    "transliteration": "Sad",
    "translation": "Sad",
    "type": "meccan",
    "total_verses": 88
  },
  {
    "id": 39,
    "name": "الزمر",
    "transliteration": "Az-Zumar",
    "translation": "Skarorna",
    "type": "meccan",
    "total_verses": 75
  },
  {
    "id": 40,
    "name": "غافر",
    "transliteration": "Ghafir",
    "translation": "Han Som Förlåter",
    "type": "meccan",
    "total_verses": 85
  },
  {
    "id": 41,
    "name": "فصلت",
    "transliteration": "Fussilat",
    "translation": "En Fast Och Klar Förkunnelse",
    "type": "meccan",
    "total_verses": 54
  },
  {
    "id": 42,
    "name": "الشورى",
    "transliteration": "Ash-Shuraa",
    "translation": "Samråd",
    "type": "meccan",
    "total_verses": 53
  },
  {
    "id": 43,
    "name": "الزخرف",
    "transliteration": "Az-Zukhruf",
    "translation": "Guld",
    "type": "meccan",
    "total_verses": 89
  },
  {
    "id": 44,
    "name": "الدخان",
    "transliteration": "Ad-Dukhan",
    "translation": "Rök",
    "type": "meccan",
    "total_verses": 59
  },
  {
    "id": 45,
    "name": "الجاثية",
    "transliteration": "Al-Jathiyah",
    "translation": "På Knä",
    "type": "meccan",
    "total_verses": 37
  },
  {
    "id": 46,
    "name": "الأحقاف",
    "transliteration": "Al-Ahqaf",
    "translation": "Sanddynorna",
    "type": "meccan",
    "total_verses": 35
  },
  {
    "id": 47,
    "name": "محمد",
    "transliteration": "Muhammad",
    "translation": "Muhammad",
    "type": "medinan",
    "total_verses": 38
  },
  {
    "id": 48,
    "name": "الفتح",
    "transliteration": "Al-Fath",
    "translation": "Segern",
    "type": "medinan",
    "total_verses": 29
  },
  {
    "id": 49,
    "name": "الحجرات",
    "transliteration": "Al-Hujurat",
    "translation": "De Inre Rummen",
    "type": "medinan",
    "total_verses": 18
  },
  {
    "id": 50,
    "name": "ق",
    "transliteration": "Qaf",
    "translation": "Qaf",
    "type": "meccan",
    "total_verses": 45
  },
  {
    "id": 51,
    "name": "الذاريات",
    "transliteration": "Adh-Dhariyat",
    "translation": "De Som Virvlar Upp",
    "type": "meccan",
    "total_verses": 60
  },
  {
    "id": 52,
    "name": "الطور",
    "transliteration": "At-Tur",
    "translation": "Sinai Berg",
    "type": "meccan",
    "total_verses": 49
  },
  {
    "id": 53,
    "name": "النجم",
    "transliteration": "An-Najm",
    "translation": "Stjärnan",
    "type": "meccan",
    "total_verses": 62
  },
  {
    "id": 54,
    "name": "القمر",
    "transliteration": "Al-Qamar",
    "translation": "Månen",
    "type": "meccan",
    "total_verses": 55
  },
  {
    "id": 55,
    "name": "الرحمن",
    "transliteration": "Ar-Rahman",
    "translation": "Den Nåderike",
    "type": "medinan",
    "total_verses": 78
  },
  {
    "id": 56,
    "name": "الواقعة",
    "transliteration": "Al-Waqi'ah",
    "translation": "Det Som Måste Komma",
    "type": "meccan",
    "total_verses": 96
  },
  {
    "id": 57,
    "name": "الحديد",
    "transliteration": "Al-Hadid",
    "translation": "Järnet",
    "type": "medinan",
    "total_verses": 29
  },
  {
    "id": 58,
    "name": "المجادلة",
    "transliteration": "Al-Mujadila",
    "translation": "Hon Som Vädjar",
    "type": "medinan",
    "total_verses": 22
  },
  {
    "id": 59,
    "name": "الحشر",
    "transliteration": "Al-Hashr",
    "translation": "Mönstringen",
    "type": "medinan",
    "total_verses": 24
  },
  {
    "id": 60,
    "name": "الممتحنة",
    "transliteration": "Al-Mumtahanah",
    "translation": "Den Som Skall Förhöras",
    "type": "medinan",
    "total_verses": 13
  },
  {
    "id": 61,
    "name": "الصف",
    "transliteration": "As-Saf",
    "translation": "I Slutna Led",
    "type": "medinan",
    "total_verses": 14
  },
  {
    "id": 62,
    "name": "الجمعة",
    "transliteration": "Al-Jumu'ah",
    "translation": "Fredagsbönen",
    "type": "medinan",
    "total_verses": 11
  },
  {
    "id": 63,
    "name": "المنافقون",
    "transliteration": "Al-Munafiqun",
    "translation": "Hycklarna",
    "type": "medinan",
    "total_verses": 11
  },
  {
    "id": 64,
    "name": "التغابن",